[
  {
    "id": "mistake-woond-woont",
    "type": "mistake",
    "incorrect": "hij/zij woond",
    "correct": "hij/zij woont",
    "english": "For the third-person singular of 'wonen', use the stem 'woon' plus -t: woont.",
    "category": "present_tense_spelling",
    "week": "week_01",
    "source_images": [
      "sources/archive/2026/week_01/images/lesson-01-page-04.jpg"
    ],
    "ingestion_date": "2026-06-12",
    "tags": [
      "A1",
      "verbs",
      "spelling"
    ],
    "status": "active",
    "notes": "The handwritten conjugation table contains 'woond'; this is treated as a correction candidate."
  },
  {
    "id": "mistake-sportt-sport",
    "type": "mistake",
    "incorrect": "je sportt",
    "correct": "je sport",
    "english": "The stem of 'sporten' is already 'sport', so only one final t is written.",
    "category": "present_tense_spelling",
    "week": "week_01",
    "source_images": [
      "sources/archive/2026/week_01/images/lesson-02-page-04.jpg"
    ],
    "ingestion_date": "2026-06-12",
    "tags": [
      "A1",
      "verbs",
      "spelling"
    ],
    "status": "active",
    "notes": "Visible in the question-formation notes and included as a likely learner correction."
  }
]
